{
  "schema_version": 1,
  "anchor_id": "anchor.when_the_lights_learn_our_names",
  "title": "When the Lights Learn Our Names",
  "source_file": "references/creative-anchors/when-the-lights-learn-our-names.md",
  "source_block": {
    "start_heading": "## 0. Draft song.",
    "sha256": "d0688ac133898174859e09daac26f79e2f07e02c9a3dc99cb16bc23dd406f998",
    "paired_line_count": 13
  },
  "revision": 1,
  "status": "active_design_constraint",
  "authority": "project_owner_direction",
  "source_honesty": {
    "claim_status": "creative_input_not_source_attestation",
    "preserved_text_verbatim": true,
    "note": "The text fixes an artistic narrative test. Its Hebrew-shaped verbs, legacy regional-looking forms, obviation markers, and grammatical commentary are not source evidence or accepted contact grammar."
  },
  "protected_functions": [
    {
      "function_id": "wll.fn.modern_biblical_contrast",
      "category": "register",
      "description": "Keep the comic contrast between an ordinary modern blackout and a strongly waw-driven literary narrative cadence."
    },
    {
      "function_id": "wll.fn.named_trio",
      "category": "narrative",
      "description": "Introduce Mara, Jules, and Tina as three distinct participants and preserve a coherent arc for all three."
    },
    {
      "function_id": "wll.fn.foreground_pulse",
      "category": "rhythm",
      "description": "Preserve the mounting foreground-event pulse, peak congestion, abrupt reveal, short release, and calmer coda."
    },
    {
      "function_id": "wll.fn.participant_tracking",
      "category": "discourse",
      "description": "Make every human action recoverable across center shifts and at least two simultaneously salient noncentral third persons."
    },
    {
      "function_id": "wll.fn.light_escalation",
      "category": "imagery",
      "description": "Carry the title through failed room light, phone light, match light, lantern light, restored light, and remembered future flickers."
    },
    {
      "function_id": "wll.fn.sound_slapstick",
      "category": "humor",
      "description": "Retain the causal escalation of alarm, impact, ringing spoons, lid, pot, spill, slides, scattered objects, and involuntary dance."
    },
    {
      "function_id": "wll.fn.reveal_tableau",
      "category": "structure",
      "description": "Preserve the restored-light freeze-frame: one person on the floor, one caught with a coat, one among tools, and the pot hissing."
    },
    {
      "function_id": "wll.fn.shared_laughter",
      "category": "voice",
      "description": "Resolve the chaos through affectionate shared looking and laughter rather than blame."
    },
    {
      "function_id": "wll.fn.event_to_custom",
      "category": "narrative",
      "description": "Mark the transition from one completed incident to a recurring response or remembered custom through the wayyiqtol-derived and weqatal-derived systems."
    },
    {
      "function_id": "wll.fn.coparent_engine",
      "category": "discourse",
      "description": "Make Biblical-Hebrew-derived event framing and source-specific Algonquian participant tracking function together rather than coexist as decoration."
    }
  ],
  "identity_invariants": [
    "The title remains When the Lights Learn Our Names in English unless the owner makes a separate songwriting decision.",
    "The story retains a named trio, blackout, escalating improvised lights and slapstick, restored-light tableau, shared laughter, and a recurring coda.",
    "The main incident and final coda remain grammatically distinct so the one-time fiasco becomes remembered custom.",
    "Names-once and minimal renaming remain valuable compression targets, but never excuse unrecoverable participants.",
    "The final grammar must solve multiple-obviative reference rather than treating 'another obviative' as identification."
  ],
  "editable_elements": [
    "Every legacy verb form, exact waw morphology, participant marker, locative, plural, compound analysis, and source attribution may be replaced after research.",
    "Strategic reanchoring, overt agreement, indexing, or limited noun repetition may be introduced when needed for participant recovery.",
    "Exact predicate count may change, but the mounting pulse, congestion peak, reveal, short laugh, and calmer recurring coda remain protected.",
    "The proposed assignment of Mara, Jules, and Tina to individual gags remains a design proposal until reviewed by the owner."
  ],
  "legacy_form_inventory": [
    {
      "surface_form": "וַיּ־",
      "working_reading": "wayyiqtol-shaped chain onset",
      "function": "Rapid foreground-event chaining throughout the one-time incident.",
      "segment_ids": ["wll.01", "wll.02", "wll.03", "wll.04", "wll.05", "wll.06", "wll.07", "wll.08", "wll.09", "wll.10", "wll.11", "wll.12"],
      "disposition": "defer_pending_grammar",
      "current_record_links": [],
      "note": "Preserve the event-chain function and audible pulse; research Biblical Hebrew and design the contact morphology before retaining any exact form."
    },
    {
      "surface_form": "וְהָיָה … וְאָחֲזוּ … וְעָמְדוּ … וְהִבִּיטוּ … וְצָחֲקוּ",
      "working_reading": "weqatal-shaped recurring coda",
      "function": "Shift from the completed incident to a standing response whenever the lights flicker.",
      "segment_ids": ["wll.13"],
      "disposition": "defer_pending_grammar",
      "current_record_links": [],
      "note": "The structural contrast is protected, but the legacy forms do not prove a sourced Biblical Hebrew analysis or accepted contact paradigm."
    },
    {
      "surface_form": "יוֹ / יוֹוָא",
      "working_reading": "yo / yowa",
      "function": "Legacy proximate versus obviative participant labels.",
      "segment_ids": ["wll.03", "wll.04", "wll.05", "wll.07", "wll.08", "wll.09", "wll.10", "wll.11", "wll.12", "wll.13"],
      "disposition": "reject_as_analysis",
      "current_record_links": [],
      "note": "One proximate and one undifferentiated obviative label cannot recover three people; the reveal itself contains yowa plus another yowa."
    },
    {
      "surface_form": "וִיגְוָאמִינְק",
      "working_reading": "wigwaam-ink",
      "function": "Legacy room-place or home locative.",
      "segment_ids": ["wll.01", "wll.02", "wll.11"],
      "disposition": "replace_form_preserve_function",
      "current_record_links": [
        {"record_id": "ja.lexeme.hebrew_heder_room", "record_revision": 2, "sense_id": "ja.lexeme.hebrew_heder_room.sense.room", "relationship": "donor_lead", "coverage": "donor_only", "note": "Reviewed room donor; no contact room or locative exists."}
      ],
      "note": "The legacy form and -ink analysis remain unverified."
    },
    {
      "surface_form": "לֵנוּוָאק",
      "working_reading": "lenuwak",
      "function": "Legacy neutral plural 'people' in the opening.",
      "segment_ids": ["wll.01"],
      "disposition": "reject_as_analysis",
      "current_record_links": [
        {"record_id": "ja.lexeme.munsee_lunew_man", "record_revision": 4, "sense_id": "ja.lexeme.munsee_lunew_man.sense.man", "relationship": "conflict_probe", "coverage": "conflict", "note": "The reviewed source meaning is man, not a neutral person term for this trio."},
        {"record_id": "ja.lexeme.contact_person", "record_revision": 1, "sense_id": "ja.lexeme.contact_person.sense.primary", "relationship": "contact_candidate", "coverage": "contact_candidate", "note": "Contact adam covers person but lacks plural morphology."}
      ],
      "note": "Do not broaden a source word for man into gender-neutral people."
    },
    {
      "surface_form": "מְבּוּי",
      "working_reading": "mbuy",
      "function": "Legacy water word in the spill sequence.",
      "segment_ids": ["wll.08"],
      "disposition": "replace_form_preserve_function",
      "current_record_links": [
        {"record_id": "ja.lexeme.hebrew_mayim", "record_revision": 3, "sense_id": "ja.lexeme.hebrew_mayim.sense.water", "relationship": "donor_lead", "coverage": "donor_only", "note": "Reviewed water donor; no actual contact record yet."}
      ],
      "note": "No exact lect, source form, or locator currently supports the legacy shape."
    },
    {
      "surface_form": "תְּמָקָאן",
      "working_reading": "temakaan",
      "function": "Legacy shining-path word.",
      "segment_ids": ["wll.08"],
      "disposition": "replace_form_preserve_function",
      "current_record_links": [
        {"record_id": "ja.lexeme.munsee_aanay_road", "record_revision": 2, "sense_id": "ja.lexeme.munsee_aanay_road.sense.road", "relationship": "donor_lead", "coverage": "donor_only", "note": "Reviewed only as road; puddle-path or trail senses are not licensed."}
      ],
      "note": "The shining-path image is protected; the legacy word is not."
    },
    {
      "surface_form": "נַחְקוֹהֻמִיּוּ",
      "working_reading": "legacy naxkoohumeew, compared with sourced naxkooh(ə)meew",
      "function": "Legacy ring or sing predicate for the spoons.",
      "segment_ids": ["wll.07"],
      "disposition": "regularize_after_research",
      "current_record_links": [
        {"record_id": "ja.lexeme.munsee_naxkoohamaa_sing", "record_revision": 1, "sense_id": "ja.lexeme.munsee_naxkoohamaa_sing.sense.sing", "relationship": "donor_lead", "coverage": "donor_only", "note": "O'Meara independently prints naxkooh(ə)meew 'he sings' with analysis /naxkooh-əm-aa-w/."},
        {"record_id": "ja.lexeme.contact_sing_ai", "record_revision": 1, "sense_id": "ja.lexeme.contact_sing_ai.sense.sing", "relationship": "conflict_probe", "coverage": "conflict", "note": "The contact stem supports vocal singing only; spoons ringing or literary personification remains unlicensed."}
      ],
      "note": "The root-level resemblance is now independently supported, but legacy u, the exact ending, and the inanimate ring/sing extension still require replacement or explicit literary grammar."
    },